"id";"year_id";"title_id";"critic_score";"people_score";"consensus";"total_reviews";"total_ratings";"type"
"620";"4";"620";"92";"85";"Led by outstanding work from Emily Blunt and Benicio del Toro, Sicario is a taut, tightly wound thriller with much more on its mind than attention-getting set pieces.";"278";"50,000";"Action & Adventure"
"621";"3";"621";"91";"87";"Driven by Michael Moore's sincere humanism, Sicko is a devastating, convincing, and very entertaining documentary about the state of America's health care.";"219";"250,000";"Special Interest"
"622";"1";"622";"88";"76";"Visceral, energetic, and often very sad, Sid and Nancy is also a surprisingly touching love story, and Gary Oldman is outstanding as the late punk rock icon Sid Vicious.";"67";"25,000";"Musical & Performing Arts"
"623";"4";"623";"93";"86";"Keanu Reeves proves a groovy guide through this informative exploration of how technology is transforming cinema, with an even-handed defense for both the old and the new.";"68";"10,000";"Television"
"624";"3";"624";"97";"79";"Charming, thoughtful, and often funny, Sideways is a decidedly mature road trip comedy full of excellent performances.";"233";"100,000";"Comedy"
"625";"4";"625";"92";"86";"Silver Linings Playbook walks a tricky thematic tightrope, but David O. Russell's sensitive direction and some sharp work from a talented cast gives it true balance.";"260";"250,000";"Comedy"
"626";"4";"626";"95";"92";"Sing Street is a feel-good musical with huge heart and irresistible optimism, and its charmimg cast and hummable tunes help to elevate its familiar plotting.";"210";"10,000";"Art House & International"
"627";"4";"627";"95";"79";"Sing Your Song takes an absorbing -- if decidedly non-critical -- look at an incredible show business career and admirable public life.";"40";"1,000";"Musical & Performing Arts"
"628";"6";"628";"100";"95";"Clever, incisive, and funny, Singin' in the Rain is a masterpiece of the classical Hollywood musical.";"64";"100,000";"Classics"
"629";"4";"629";"92";"86";"Sam Mendes brings Bond surging back with a smart, sexy, riveting action thriller that qualifies as one of the best 007 films to date.";"379";"250,000";"Action & Adventure"
"630";"4";"630";"100";"72";"Slay the Dragon takes a suitably outraged -- but ultimately optimistic -- look at modern-day gerrymandering that doubles as a heartfelt call to action.";"49";"Fewer than 50";"Documentary"
"631";"6";"631";"89";"80";"This Disney dreamscape contains moments of grandeur, with its lush colors, magical air, one of the most menacing villains in the Disney canon.";"44";"250,000";"Animation"
"632";"3";"632";"91";"90";"Visually dazzling and emotionally resonant, Slumdog Millionaire is a film that's both entertaining and powerful.";"289";"250,000";"Romance"
"633";"6";"633";"98";"78";"With its involving story and characters, vibrant art, and memorable songs, Snow White and the Seven Dwarfs set the animation standard for decades to come.";"52";"250,000";"Animation"
"634";"4";"634";"94";"72";"Snowpiercer offers an audaciously ambitious action spectacular for filmgoers numb to effects-driven blockbusters.";"255";"50,000";"Science Fiction & Fantasy"
"635";"6";"635";"94";"90";"Solaris is a haunting, meditative film that uses sci-fi to raise complex questions about humanity and existence.";"62";"25,000";"Art House & International"
"636";"6";"636";"95";"94";"Some Like It Hot: A spry, quick-witted farce that never drags.";"65";"50,000";"Classics"
"637";"6";"637";"98";"94";"A film that requires and rewards patience in equal measure, Pather Panchali finds director Satyajit Ray delivering a classic with his debut.";"48";"5,000";"Art House & International"
"638";"4";"638";"99";"92";"Song of the Sea boasts narrative depth commensurate with its visual beauty, adding up to an animated saga overflowing with family-friendly riches.";"97";"10,000";"Animation"
"639";"4";"639";"93";"70";"Fearlessly ambitious, scathingly funny, and thoroughly original, Sorry to Bother You loudly heralds the arrival of a fresh filmmaking talent in writer-director Boots Riley.";"307";"5,000";"Comedy"
"640";"4";"640";"45";"75";"There's an amazing true story at the heart of Soul Surfer -- and unfortunately, it's drowned by waves of Hollywood cheese.";"106";"25,000";"Sports & Fitness"
"641";"4";"641";"100";"90";"Smart, affectionate, and unabashedly sincere, Sound City pairs a great soundtrack with a well-argued ode to one of rock 'n' roll's most fondly remembered bygone eras.";"46";"5,000";"Documentary"
"642";"3";"642";"97";"83";"A suspenseful, gripping documentary that features an engaging cross section of American children.";"139";"10,000";"Documentary"
"643";"4";"643";"90";"95";"A breezily unpredictable blend of teen romance and superhero action, Spider-Man: Far from Home stylishly sets the stage for the next era of the MCU.";"448";"50,000";"Action & Adventure"
"644";"4";"644";"92";"87";"Spider-Man: Homecoming does whatever a second reboot can, delivering a colorful, fun adventure that fits snugly in the sprawling MCU without getting bogged down in franchise-building.";"391";"100,000";"Action & Adventure"
"645";"4";"645";"97";"93";"Spider-Man: Into the Spider-Verse matches bold storytelling with striking animation for a purely enjoyable adventure with heart, humor, and plenty of superhero action.";"387";"10,000";"Action & Adventure"
"646";"3";"646";"97";"96";"Spirited Away is a dazzling, enchanting, and gorgeously drawn fairy tale that will leave viewers a little more curious and fascinated by the world around them.";"189";"250,000";"Animation"
"647";"4";"647";"98";"70";"A dark teen comedy with an explosive twist, Spontaneous reaffirms Katherine Langford as a rising star -- and marks debuting director Brian Duffield as a filmmaker to watch.";"58";"250";"Horror"
"648";"4";"648";"97";"93";"Spotlight gracefully handles the lurid details of its fact-based story while resisting the temptation to lionize its heroes, resulting in a drama that honors the audience as well as its real-life subjects.";"371";"50,000";"Drama"
"649";"4";"649";"95";"78";"Simultaneously broad and progressive, Spy offers further proof that Melissa McCarthy and writer-director Paul Feig bring out the best in one another -- and delivers scores of belly laughs along the way.";"259";"50,000";"Comedy"
"650";"3";"650";"93";"46";"A kinetic and fun movie that's sure to thrill children of all ages.";"128";"250,000";"Kids & Family"
"651";"6";"651";"100";"86";"Typifying the best that the Western genre has to offer, Stagecoach is a rip-roaring adventure given dramatic heft by John Ford's dynamic direction and John Wayne's mesmerizing star turn.";"45";"10,000";"Action & Adventure"
"652";"6";"652";"100";"93";"Stalker is a complex, oblique parable that draws unforgettable images and philosophical musings from its sci-fi/thriller setting.";"41";"25,000";"Action & Adventure"
"653";"3";"653";"94";"91";"Star Trek reignites a classic franchise with action, humor, a strong story, and brilliant visuals, and will please traditional Trekkies and new fans alike.";"354";"250,000";"Action & Adventure"
"654";"6";"654";"92";"96";"A legendarily expansive and ambitious start to the sci-fi saga, George Lucas opened our eyes to the possibilities of blockbuster filmmaking and things have never been the same.";"132";"250,000";"Action & Adventure"
"655";"4";"655";"93";"86";"Packed with action and populated by both familiar faces and fresh blood, The Force Awakens successfully recalls the series' former glory while injecting it with renewed energy.";"440";"100,000";"Action & Adventure"
"656";"4";"656";"90";"42";"Star Wars: The Last Jedi honors the saga's rich legacy while adding some surprising twists -- and delivering all the emotion-rich action fans could hope for.";"476";"100,000";"Action & Adventure"
"657";"3";"657";"54";"70";"Steep is a mixed bag of breathtaking mountain footage and yawn-inducing banter.";"48";"500";"Sports & Fitness"
"658";"3";"658";"81";"93";"A perfect companion piece to The Endless Summer.";"80";"5,000";"Sports & Fitness"
"659";"3";"659";"100";"90";"Hirokazu Kore-eda's film may seem modest at first, but this family drama casts a delicate, entrancing spell.";"64";"2,500";"Art House & International"
"660";"3";"660";"81";"74";"The harder they come, the harder they fall -- this film shows, in raw, gripping detail, that even skater dudes can't resist the life of the rich and famous. It's more poignant than hard-core, and gives us a portrait of a life run over by the whims of the entertainment industry.";"47";"250";"Sports & Fitness"
"661";"1";"661";"100";"98";"Jonathan Demme's Stop Making Sense captures the energetic, unpredictable live act of peak Talking Heads with color and visual wit.";"41";"5,000";"Documentary"
"662";"6";"662";"95";"81";"Stormy Weather's depiction of the Black community is disappointingly facile, but its delightful musical numbers drown out any missed narrative notes.";"41";"1,000";"Classics"
"663";"4";"663";"89";"91";"Straight Outta Compton is a biopic that's built to last, thanks to F. Gary Gray's confident direction and engaging performances from a solid cast.";"247";"10,000";"Musical & Performing Arts"
"664";"6";"664";"98";"92";"A provocative premise and inventive set design lights the way for Hitchcock diabolically entertaining masterpiece.";"49";"25,000";"Mystery & Suspense"
"665";"4";"665";"100";"57";"Strong Island uses one family's heartbreaking tragedy to offer a sobering picture of racial injustice in modern America.";"48";"500";"Documentary"
"666";"3";"666";"92";"80";"Sugar is an exceptionally-crafted film -- part sports flick, part immigrant tale -- with touching and poignant drama highlighted by splendid performances.";"138";"10,000";"Sports & Fitness"
"667";"3";"667";"56";"57";"Inventive and off-kilter, the newest feast from J-Horror director Takashi Miike is super-sensory, self-referential and somewhat excessive.";"55";"10,000";"Western"
"668";"3";"668";"94";"70";"Olivier Assayas' contemplative family drama handles lofty ideas about art and culture with elegance and lightness.";"106";"10,000";"Kids & Family"
"669";"6";"669";"98";"92";"Boasting masterful cinematography to match its well-acted, wonderfully romantic storyline, Sunrise is perhaps the final -- and arguably definitive -- statement of the silent era.";"61";"5,000";"Mystery & Suspense"
"670";"6";"670";"99";"95";"Arguably the greatest movie about Hollywood, Billy Wilder's masterpiece Sunset Boulevard is a tremendously entertaining combination of noir, black comedy, and character study.";"71";"50,000";"Classics"
"671";"3";"671";"92";"72";"Entertaining doc about the adverse effects of eating fast food.";"171";"250,000";"Special Interest"
"672";"3";"672";"98";"66";"An intriguing account of a unique family.";"46";"25,000";"Special Interest"
"673";"6";"673";"93";"83";"The blood pours freely in Argento's classic Suspiria, a giallo horror as grandiose and glossy as it is gory.";"59";"25,000";"Horror"
"674";"3";"674";"86";"81";"Full of pith and Grand Guignol grossness, this macabre musical is perfectly helmed and highly entertaining. Tim Burton masterfully stages the musical in a way that will make you think he has done this many times before.";"231";"250,000";"Musical & Performing Arts"
"675";"6";"675";"98";"92";"Sweet Smell of Success boasts a top-notch cast, sharp direction, atmospheric cinematography, and an appropriately jazzy score, making it one of the best noir crime thrillers ever made.";"52";"5,000";"Classics"
"676";"3";"676";"97";"65";"At once tender and unsentimental, Sweetgrass gracefully captures the beauty and hardships of a dying way of life.";"64";"500";"Special Interest"
"677";"3";"677";"71";"73";"Though it occasionally stalls, Talladega Nights' mix of satire, clever gags, and excellent ensemble performances put it squarely in the winner's circle.";"187";"250,000";"Sports & Fitness"
"678";"1";"678";"100";"93";"Thanks to director Juzo Itami's offbeat humor and sharp satirical edge, Tampopo is a funny, sexy, affectionate celebration of food and its broad influence on Japanese culture.";"55";"5,000";"Art House & International"
"679";"3";"679";"89";"87";"While far from Disney's greatest film, Tangled is a visually stunning, thoroughly entertaining addition to the studio's classic animated canon.";"227";"100,000";"Animation"
"680";"6";"680";"96";"93";"A must-see film for movie lovers, this Martin Scorsese masterpiece is as hard-hitting as it is compelling, with Robert De Niro at his best.";"94";"250,000";"Drama"
"681";"3";"681";"100";"90";"Taxi to the Dark Side is an intelligent, powerful look into the dark corners of the War on Terror.";"93";"5,000";"Documentary"
"682";"2";"682";"75";"76";"With a vibrant pastel color scheme and stylized action sequences, Tears of the Black Tiger is a bizarre, yet thoroughly entertaining Thai western.";"63";"2,500";"Western"
"683";"4";"683";"91";"71";"Teen Titans Go! To the Movies distills the enduring appeal of its colorful characters into a charmingly light-hearted adventure whose wacky humor fuels its infectious fun -- and belies a surprising level of intelligence.";"132";"2,500";"Animation"
"684";"3";"684";"88";"66";"The dysfunctional interaction between director and subject is fascinating, poignant, and revealing of both men and of father-son relationships in general.";"65";"1,000";"Television"
"685";"3";"685";"2";"29";"As far as westerns go, Texas Rangers is strictly mediocre stuff.";"51";"5,000";"Western"
"686";"2";"686";"93";"78";"A light, sweet, and thoroughly entertaining debut for director Tom Hanks, That Thing You Do! makes up in charm what it lacks in complexity.";"58";"100,000";"Kids & Family"
"687";"6";"687";"96";"86";"Packed with twists and turns, this essential early Alfred Hitchcock feature hints at the dazzling heights he'd reach later in his career.";"52";"10,000";"Action & Adventure"
"688";"6";"688";"100";"94";"A seminal French New Wave film that offers an honest, sympathetic, and wholly heartbreaking observation of adolescence without trite nostalgia.";"64";"25,000";"Art House & International"
"689";"4";"689";"95";"85";"Raw, terrifying, and painfully difficult to watch, The Act of Killing offers a haunting testament to the edifying, confrontational power of documentary cinema.";"159";"10,000";"Documentary"
"690";"6";"690";"100";"89";"Errol Flynn thrills as the legendary title character, and the film embodies the type of imaginative family adventure tailor-made for the silver screen.";"48";"25,000";"Action & Adventure"
"691";"6";"691";"98";"86";"Perfectly cast, smartly written, and beautifully filmed, The African Queen remains thrilling, funny, and effortlessly absorbing even after more than half a century's worth of adventure movies borrowing liberally from its creative DNA.";"45";"25,000";"Action & Adventure"
"692";"3";"692";"29";"45";"Too conventional and uninvolving to be memorable.";"159";"10,000";"Western"
"693";"6";"693";"93";"94";"Director Billy Wilder's customary cynicism is leavened here by tender humor, romance, and genuine pathos.";"72";"25,000";"Comedy"
"694";"3";"694";"96";"74";"Smart and inventive, The Arbor offers some intensely memorable twists on tired documentary tropes.";"46";"1,000";"Special Interest"
"695";"4";"695";"82";"76";"Smartly constructed and scathingly sharp, The Armstrong Lie presents an effective indictment of its unscrupulous subject -- as well as the sports culture that spawned him.";"122";"5,000";"Sports & Fitness"
"696";"4";"696";"95";"87";"A crowd-pleasing tribute to the magic of silent cinema, The Artist is a clever, joyous film with delightful performances and visual style to spare.";"319";"50,000";"Comedy"
"697";"3";"697";"76";"75";"On the strength of its two lead performances Assassination is an expertly crafted period piece, and an insightful look at one of the enduring figures of American lore.";"176";"50,000";"Western"
"698";"4";"698";"98";"72";"The Babadook relies on real horror rather than cheap jump scares -- and boasts a heartfelt, genuinely moving story to boot.";"239";"25,000";"Drama"
"699";"4";"699";"89";"77";"The Ballad of Buster Scruggs avoids anthology pitfalls with a consistent collection tied together by the Coen brothers' signature blend of dark drama and black humor.";"231";"2,500";"Western"
"700";"2";"700";"76";"65";"It sometimes moseys when it should have galloped, but The Ballad of Little Jo entertainingly upends genre formula while simultaneously highlighting its strengths.";"50";"1,000";"Western"
"701";"3";"701";"98";"86";"The Band's Visit is both a clever, subtle slice-of-life comedy, and poignant cross-cultural exploration.";"119";"10,000";"Art House & International"
"702";"6";"702";"99";"95";"A documentary-like depiction of a nation's real-life efforts to expel a colonizing force, The Battle of Algiers puts viewers on the front lines with gripping realism.";"89";"10,000";"Art House & International"
"703";"3";"703";"96";"89";"An enchanting self-portrait by a veteran director, Beach of Agnes is equal parts playful and profound.";"72";"1,000";"Musical & Performing Arts"
"704";"6";"704";"97";"93";"An engrossing look at the triumphs and travails of war veterans, The Best Years of Our Lives is concerned specifically with the aftermath of World War II, but its messages speak to the overall American experience.";"61";"10,000";"Classics"
"705";"4";"705";"98";"88";"Funny, heartfelt, and intelligent, The Big Sick uses its appealing leads and cross-cultural themes to prove the standard romcom formula still has some fresh angles left to explore.";"302";"25,000";"Comedy"
"706";"6";"706";"97";"91";"A perfect match of screenplay, director, and leading man, The Big Sleep stands as a towering achievement in film noir whose grim vitality remains undimmed.";"65";"25,000";"Classics"
"707";"6";"707";"95";"83";"Proving once again that build-up is the key to suspense, Alfred Hitchcock successfully turned birds into some of the most terrifying villains in horror history.";"57";"100,000";"Horror"
"708";"3";"708";"66";"85";"It might strike some viewers as a little too pat, but The Blind Side has the benefit of strong source material and a strong performance from Sandra Bullock.";"206";"250,000";"Sports & Fitness"
"709";"6";"709";"96";"86";"Marlene Dietrich steals more than one show in this backstage tragedy about a lowly professor besotted with a cruel and enigmatic singer.";"45";"5,000";"Art House & International"
"710";"2";"710";"80";"74";"The Boxer is a standard drama that packs a true emotional wallop thanks to the highly tuned central performances.";"70";"5,000";"Sports & Fitness"
"711";"4";"711";"95";"87";"The Breadwinner's stunning visuals are matched by a story that dares to confront sobering real-life issues with uncommon -- and richly rewarding -- honesty.";"105";"1,000";"Animation"
"712";"6";"712";"95";"93";"This complex war epic asks hard questions, resists easy answers, and boasts career-defining work from star Alec Guinness and director David Lean.";"60";"50,000";"Action & Adventure"
"713";"4";"713";"92";"74";"The Cabin in the Woods is an astonishing meta-feat, capable of being funny, strange, and scary -- frequently all at the same time.";"286";"100,000";"Horror"
"714";"6";"714";"99";"89";"Arguably the first true horror film, The Cabinet of Dr. Caligari set a brilliantly high bar for the genre -- and remains terrifying nearly a century after it first stalked the screen.";"67";"25,000";"Art House & International"
"715";"2";"715";"62";"48";"Though it sometimes feels cold and detached, The Claim is evocative, beautifully shot, and full of understated performances.";"85";"2,500";"Western"
"716";"3";"716";"95";"82";"Energetic and bright, this hybrid of documentary style and dramatic plotting looks at the present and future of France through the interactions of a teacher and his students in an inner city high school.";"161";"10,000";"Art House & International"
"717";"1";"717";"89";"73";"That it's inferior to the original goes without saying, but Paul Newman and Tom Cruise are a joy to watch, and Martin Scorsese's direction is typically superb.";"47";"25,000";"Sports & Fitness"
"718";"6";"718";"98";"90";"A commentary on fascism and beauty alike, Bernardo Bertolucci's The Conformist is acclaimed for its sumptuous visuals and extravagant, artful cinematography.";"56";"5,000";"Art House & International"
"719";"4";"719";"86";"83";"Well-crafted and gleefully creepy, The Conjuring ratchets up dread through a series of effective old-school scares.";"223";"100,000";"Horror"
"720";"6";"720";"96";"90";"This tense, paranoid thriller presents Francis Ford Coppola at his finest -- and makes some remarkably advanced arguments about technology's role in society that still resonate today.";"56";"25,000";"Mystery & Suspense"
"721";"4";"721";"96";"94";"Smart, compassionate, and moving, The Crash Reel uses the familiar sport-doc formula to subvert expectations and ask challenging questions about ambition and achievement.";"46";"1,000";"Sports & Fitness"
"722";"2";"722";"94";"78";"The Crying Game is famous for its shocking twist, but this thoughtful, haunting mystery grips the viewer from start to finish.";"66";"25,000";"Romance"
"723";"3";"723";"92";"85";"Better than your average football pic, Damned United is carried by another star turn from Michael Sheen as Brian Clough.";"139";"50,000";"Sports & Fitness"
"724";"4";"724";"92";"63";"The Dark and the Wicked delivers on its title with an unsettling horror story whose deep dread and bleak outlook further compound its effective jolts.";"101";"250";"Horror"
"725";"3";"725";"94";"94";"Dark, complex, and unforgettable, The Dark Knight succeeds not just as an entertaining comic book film, but as a richly thrilling crime saga.";"344";"250,000";"Action & Adventure"
"726";"4";"726";"16";"45";"Go then, there are other Stephen King adaptations than these.";"275";"25,000";"Western"
"727";"6";"727";"95";"87";"Socially minded yet entertaining, The Day the Earth Stood Still imparts its moral of peace and understanding without didacticism.";"57";"25,000";"Classics"
"728";"4";"728";"95";"78";"The Death of Stalin finds director/co-writer Arnando Iannucci in riotous form, bringing his scabrous political humor to bear on a chapter in history with painfully timely parallels.";"247";"5,000";"Comedy"
"729";"3";"729";"96";"90";"The Devil Came on Horseback is both a strong primer on the complexities of the situation in Darfur and a harrowing first-person doc.";"54";"2,500";"Special Interest"
"730";"4";"730";"91";"85";"Oh, hai Mark. The Disaster Artist is a surprisingly poignant and charming movie-about-a-movie that explores the creative process with unexpected delicacy.";"348";"10,000";"Comedy"
"731";"6";"731";"98";"89";"";"53";"10,000";"Art House & International"
"732";"4";"732";"94";"83";"The Edge of Seventeen's sharp script -- and Hailee Steinfeld's outstanding lead performance -- make this more than just another coming-of-age dramedy.";"215";"25,000";"Comedy"
"733";"6";"733";"94";"97";"Dark, sinister, but ultimately even more involving than A New Hope, The Empire Strikes Back defies viewer expectations and takes the series to heightened emotional levels.";"104";"250,000";"Action & Adventure"
"734";"4";"734";"92";"67";"The Endless benefits from its grounded approach to an increasingly bizarre story, elevated by believable performances by filmmakers Justin Benson and Aaron Moorhead.";"130";"2,500";"Horror"
"735";"1";"735";"95";"84";"This classic low budget horror film combines just the right amount of gore and black humor, giving The Evil Dead an equal amount of thrills and laughs.";"61";"100,000";"Horror"
"736";"4";"736";"97";"87";"The Farewell deftly captures complicated family dynamics with a poignant, well-acted drama that marries cultural specificity with universally relatable themes.";"341";"1,000";"Comedy"
"737";"4";"737";"93";"69";"The Favourite sees Yorgos Lanthimos balancing a period setting against rich, timely subtext - and getting roundly stellar performances from his well-chosen stars.";"413";"5,000";"Drama"
"738";"4";"738";"99";"71";"The Fight takes an engaging look at some of the people working on the front lines for the ACLU -- and makes a passionate case for the legal battles they wage.";"67";"Fewer than 50";"Documentary"
"739";"3";"739";"90";"89";"Led by a trio of captivating performances from Mark Wahlberg, Christian Bale, and Amy Adams, The Fighter is a solidly entertaining, albeit predictable, entry in the boxing drama genre.";"252";"100,000";"Sports & Fitness"
"740";"2";"740";"95";"88";"The Filth and the Fury is a complete and completely unabashed look at The Sex Pistols, shot in suitably propulsive punk fashion.";"40";"5,000";"Musical & Performing Arts"
"741";"3";"741";"89";"85";"Both an intriguing intellectual exercise and an amusing look at the contrasts between the two filmmakers.";"62";"5,000";"Television"
"742";"4";"742";"96";"80";"The Florida Project offers a colorfully empathetic look at an underrepresented part of the population that proves absorbing even as it raises sobering questions about modern America.";"313";"10,000";"Drama"
"743";"6";"743";"95";"71";"Deliciouly funny to some and eerily presicient to others, The Fly walks a fine line between shlocky fun and unnerving nature parable.";"40";"10,000";"Horror"
"744";"3";"744";"96";"93";"The Fog of War draws on decades of bitter experience to offer a piercing perspective on the Cold War from one of its major architects.";"142";"10,000";"Documentary"
"745";"4";"745";"98";"69";"The Forty-Year-Old Version opens a compelling window into the ebbs and flows of the artist's life -- and announces writer-director-star Radha Blank as a major filmmaking talent with her feature debut.";"126";"100";"Comedy"
