"id";"year_id";"title_id";"critic_score";"people_score";"consensus";"total_reviews";"total_ratings";"type"
"1";"4";"1";"98";"92";"Inventive, thought-provoking, and funny, 8 1/2 represents the arguable peak of Federico Fellini's many towering feats of cinema.";"52";"25,000";"Art House & International"
"2";"6";"2";"89";"88";"Hard-hitting, immersive, and an impressive technical achievement, 1917 captures the trench warfare of World War I with raw, startling immediacy.";"454";"25,000";"Drama"
"3";"4";"3";"90";"79";"Smart, solidly crafted, and palpably tense, 10 Cloverfield Lane makes the most of its confined setting and outstanding cast -- and suggests a new frontier for franchise filmmaking.";"312";"50,000";"Mystery & Suspense"
"4";"4";"4";"100";"97";"Sidney Lumet's feature debut is a superbly written, dramatically effective courtroom thriller that rightfully stands as a modern classic.";"55";"100,000";"Classics"
"5";"3";"5";"95";"90";"It's far from comfortable viewing, but 12 Years a Slave's unflinchingly brutal look at American slavery is also brilliant -- and quite possibly essential -- cinema.";"371";"100,000";"Drama"
"6";"4";"6";"97";"90";"13th strikes at the heart of America's tangled racial history, offering observations as incendiary as they are calmly controlled.";"104";"2,500";"Documentary"
"7";"4";"7";"32";"37";"As critical as it is about sensationalism in the media, 15 Minutes itself indulges in lurid violence, and its satire is too heavy-handed to be effective.";"125";"50,000";"Television"
"8";"4";"8";"99";"82";"Rich, insightful, and occasionally heartbreaking, 20 Feet From Stardom is an energetic tribute to the passion, talent, and hard work of backup singers.";"128";"10,000";"Documentary"
"9";"6";"9";"95";"78";"Revealing yet respectful, 20,000 Days on Earth is essential viewing for any Nick Cave fan.";"87";"2,500";"Musical & Performing Arts"
"10";"3";"10";"92";"89";"One of the most influential of all sci-fi films -- and one of the most controversial -- Stanley Kubrick's 2001 is a delicate, poetic meditation on the ingenuity -- and folly -- of mankind.";"113";"250,000";"Classics"
"11";"3";"11";"87";"85";"Kinetically directed by Danny Boyle, 28 Days Later is both a terrifying zombie movie and a sharp political allegory.";"232";"250,000";"Horror"
"12";"3";"12";"89";"86";"This remake of a classic Western improves on the original, thanks to fiery performances from Russell Crowe and Christian Bale as well as sharp direction from James Mangold.";"223";"250,000";"Western"
"13";"4";"13";"97";"87";"The latest installment in this remarkable series, 49 Up is a satisfying continuation of Michael Apted's singular sociological and cinematic experiment.";"65";"25,000";"Musical & Performing Arts"
"14";"4";"14";"96";"88";"";"48";"1,000";"Special Interest"
"15";"6";"15";"99";"76";"Director Michael Apted continues to utilize cinema as a window into the lives of everyday people, and in the reflection of this documentary we can glimpse our own aging humanity.";"69";"5,000";"Documentary"
"16";"4";"16";"94";"85";"A Band Called Death is not only a fascinating portrait of a pioneering rock group, but also a tribute to family ties and perseverance in the face of hardship.";"52";"5,000";"Musical & Performing Arts"
"17";"2";"17";"92";"73";"A Bug's Life is a rousing adventure that blends animated thrills with witty dialogue and memorable characters - and another smashing early success for Pixar.";"88";"250,000";"Animation"
"18";"1";"18";"89";"88";"Both warmly nostalgic and darkly humorous, A Christmas Story deserves its status as a holiday perennial.";"57";"250,000";"Kids & Family"
"19";"4";"19";"94";"78";"Subtle and tender, A Fantastic Woman handles its timely, sensitive subject matter with care.";"221";"1,000";"Art House & International"
"20";"3";"20";"97";"86";"A heartbreaking, haunting historical document, A Film Unfinished excavates particularly horrible chapter of Holocaust history, and in doing so, the film provides a glimpse into the Nazi propaganda machine.";"65";"1,000";"Special Interest"
"21";"6";"21";"98";"91";"With Akira Kurosawa's Yojimbo as his template, Sergio Leone's A Fistful of Dollars helped define a new era for the Western and usher in its most iconic star, Clint Eastwood.";"51";"50,000";"Action & Adventure"
"22";"4";"22";"96";"75";"A Girl Walks Home Alone at Night blends conventional elements into something brilliantly original -- and serves as a striking calling card for writer-director Ana Lily Amirpour.";"134";"10,000";"Horror"
"23";"6";"23";"98";"89";"A Hard Day's Night, despite its age, is still a delight to watch and has proven itself to be a rock-and-roll movie classic.";"109";"50,000";"Classics"
"24";"2";"24";"78";"84";"Sentimental and light, but still thoroughly charming, A League of Their Own is buoyed by solid performances from a wonderful cast.";"69";"250,000";"Sports & Fitness"
"25";"4";"25";"33";"41";"While it offers a few laughs and boasts a talented cast, Seth MacFarlane's overlong, aimless A Million Ways to Die in the West is a disappointingly scattershot affair.";"211";"50,000";"Western"
"26";"4";"26";"86";"81";"A Monster Calls deftly balances dark themes and fantastical elements to deliver an engrossing and uncommonly moving entry in the crowded coming-of-age genre.";"266";"25,000";"Kids & Family"
"27";"6";"27";"97";"91";"Watermelons may go out of season, but in A Night at the Opera, the Marx Brothers' daffy laughs are never anything less than uproariously fresh.";"69";"10,000";"Classics"
"28";"1";"28";"94";"84";"Wes Craven's intelligent premise, combined with the horrifying visual appearance of Freddy Krueger, still causes nightmares to this day.";"54";"250,000";"Horror"
"29";"3";"29";"96";"89";"Featuring an impressive star turn by newcomer Tahar Rahim, A Prophet is a French gangster film filled with arresting, immediate details.";"162";"10,000";"Art House & International"
"30";"4";"30";"96";"82";"A Quiet Place artfully plays on elemental fears with a ruthlessly intelligent creature feature that's as original as it is scary -- and establishes director John Krasinski as a rising talent.";"384";"10,000";"Drama"
"31";"4";"31";"100";"91";"In telling one couple's story, A Secret Love pays understated yet powerful tribute to a lifetime of choices and sacrifices made in the name of enduring devotion.";"43";"100";"Documentary"
"32";"4";"32";"99";"92";"Morally complex, suspenseful, and consistently involving, A Separation captures the messiness of a dissolving relationship with keen insight and searing intensity.";"179";"10,000";"Art House & International"
"33";"4";"33";"96";"80";"A Shaun the Sheep Movie: Farmageddon retains the charm of its small-screen source material while engagingly expanding the title character's world.";"75";"250";"Animation"
"34";"4";"34";"90";"79";"With appealing leads, deft direction, and an affecting love story, A Star Is Born is a remake done right -- and a reminder that some stories can be just as effective in the retelling.";"524";"10,000";"Drama"
"35";"6";"35";"98";"90";"A feverish rendition of a heart-rending story, A Streetcar Named Desire gives Tennessee Williams' stage play explosive power on the screen thanks to Elia Kazan's searing direction and a sterling ensemble at the peak of their craft.";"60";"50,000";"Classics"
"36";"2";"36";"98";"83";"With A Summer's Tale, Eric Rohmer continues his ""Tales of the Four Seasons"" in typically Rohmeresque fashion -- and for cineastes, that's excellent news indeed.";"47";"5,000";"Romance"
"37";"3";"37";"93";"55";"About a Boy benefits tremendously from Hugh Grant's layered performance, as well as a funny, moving story that tugs at the heartstrings without tilting into treacle.";"187";"250,000";"Romance"
"38";"3";"38";"100";"77";"An enlightening and sobering documentary on Afghanistan's very own X-Factor.";"62";"5,000";"Art House & International"
"39";"4";"39";"96";"80";"After the Storm crosses cultural lines to offer timeless observations about parental responsibilities, personal bonds, and the capacity for forgiveness.";"138";"1,000";"Art House & International"
"40";"6";"40";"96";"91";"A haunting journey of natural wonder and tangible danger, Aguirre transcends epic genre trappings and becomes mythological by its own right.";"50";"10,000";"Action & Adventure"
"41";"4";"41";"98";"87";"";"83";"5,000";"Documentary"
"42";"6";"42";"97";"89";"Though unabashedly juvenile and silly, Airplane! is nevertheless an uproarious spoof comedy full of quotable lines and slapstick gags that endure to this day.";"67";"250,000";"Comedy"
"43";"2";"43";"95";"92";"A highly entertaining entry in Disney's renaissance era,"" Aladdin is beautifully drawn, with near-classic songs and a cast of scene-stealing characters.";"74";"250,000";"Animation"
"44";"6";"44";"98";"94";"A modern classic, Alien blends science fiction, horror and bleak poetry into a seamless whole.";"125";"250,000";"Drama"
"45";"1";"45";"97";"94";"While Alien was a marvel of slow-building, atmospheric tension, Aliens packs a much more visceral punch, and features a typically strong performance from Sigourney Weaver.";"76";"250,000";"Action & Adventure"
"46";"6";"46";"99";"94";"Smart, sophisticated, and devastatingly funny, All About Eve is a Hollywood classic that only improves with age.";"98";"25,000";"Classics"
"47";"2";"47";"98";"93";"Almodovar weaves together a magnificent tapestry of femininity with an affectionate wink to classics of theater and cinema in this poignant story of love, loss and compassion.";"90";"50,000";"Art House & International"
"48";"4";"48";"100";"72";"All In: The Fight for Democracy lives up to its title as a galvanizing rallying cry for voters to exercise -- and preserve -- their right to be heard.";"65";"50";"Documentary"
"49";"4";"49";"94";"63";"Anchored by another tremendous performance in a career full of them, All Is Lost offers a moving, eminently worthwhile testament to Robert Redford's ability to hold the screen.";"240";"25,000";"Action & Adventure"
"50";"6";"50";"98";"89";"Director Lewis Milestone's brilliant anti-war polemic, headlined by an unforgettable performance from Lew Ayres, lays bare the tragic foolishness at the heart of war.";"80";"10,000";"Classics"
"51";"1";"51";"93";"95";"A lavish, entertaining, powerful film about the life and influence, both positive and negative, of one of Western culture's great artists.";"100";"100,000";"Musical & Performing Arts"
"52";"4";"52";"99";"80";"Brilliantly capturing a remarkable performer near the peak of her prodigious power, Amazing Grace is a thrilling must-watch documentary for Aretha Franklin fans.";"158";"250";"Documentary"
"53";"2";"53";"94";"90";"Well worth watching for film buffs and anyone who believes in following your dreams, American Movie is a warm, funny, and engrossing ode to creative passion.";"48";"10,000";"Television"
"54";"3";"54";"14";"68";"With corny dialogue, revisionist history, anachronistic music, and a generically attractive cast, American Outlaws is a sanitized, teenybopper version of Jesse James.";"103";"25,000";"Western"
"55";"4";"55";"93";"82";"With towering performances and an unflinching script from Michael Haneke, Amour represents an honest, heartwrenching depiction of deep love and responsibility.";"224";"10,000";"Art House & International"
"56";"4";"56";"95";"87";"As riveting as it is sad, Amy is a powerfully honest look at the twisted relationship between art and celebrity -- and the lethal spiral of addiction.";"223";"10,000";"Art House & International"
"57";"6";"57";"96";"79";"The plot may be problematic, but such concerns are rendered superfluous by Gene Kelly and Leslie Caron's star power, the Gershwins' classic songs, and Vincente Minnelli's colorful, sympathetic direction.";"68";"25,000";"Classics"
"58";"3";"58";"93";"79";"This candid, powerful and informative documentary illuminates some of the myths surrounding its dual subjects: global warming and Al Gore.";"166";"100,000";"Special Interest"
"59";"6";"59";"100";"90";"One of cinema's greatest courtroom dramas, Anatomy of a Murder is tense, thought-provoking, and brilliantly acted, with great performances from James Stewart and George C. Scott.";"48";"10,000";"Classics"
"60";"6";"60";"96";"92";"Filled with poignant performances and devastating humor, Annie Hall represents a quantum leap for Woody Allen and remains an American classic.";"83";"100,000";"Comedy"
"61";"4";"61";"88";"66";"Annihilation backs up its sci-fi visual wonders and visceral genre thrills with an impressively ambitious -- and surprisingly strange -- exploration of challenging themes that should leave audiences pondering long after the end credits roll.";"319";"10,000";"Action & Adventure"
"62";"4";"62";"92";"71";"Anomalisa marks another brilliant and utterly distinctive highlight in Charlie Kaufman's filmography, and a thought-provoking treat for fans of introspective cinema.";"275";"10,000";"Animation"
"63";"4";"63";"87";"75";"A lighter, brighter superhero movie powered by the effortless charisma of Paul Rudd and Evangeline Lilly, Ant-Man and The Wasp offers a much-needed MCU palate cleanser.";"433";"25,000";"Action & Adventure"
"64";"2";"64";"92";"52";"Featuring a stellar voice cast, technically dazzling animation, and loads of good humor, Antz should delight both children and adults.";"93";"250,000";"Animation"
"65";"3";"65";"98";"91";"A touching, uplifting and inspirational rockumentary about an aging metal band, both hilarious and heart-warming in equal measure.";"140";"5,000";"Documentary"
"66";"6";"66";"98";"94";"Francis Ford Coppola's haunting, hallucinatory Vietnam War epic is cinema at its most audacious and visionary.";"96";"250,000";"Action & Adventure"
"67";"4";"67";"99";"90";"Edifying and inspiring in equal measure, Apollo 11 uses artfully repurposed archival footage to send audiences soaring back to a pivotal time in American history.";"184";"1,000";"Documentary"
"68";"2";"68";"96";"87";"In recreating the troubled space mission, Apollo 13 pulls no punches: it's a masterfully told drama from director Ron Howard, bolstered by an ensemble of solid performances.";"92";"250,000";"Action & Adventure"
"69";"3";"69";"76";"55";"A traditional genre western, Appaloosa sets itself apart with smart psychology, an intriguing love triangle, and good chemistry between the leads.";"164";"50,000";"Western"
"70";"1";"70";"93";"54";"Arachnophobia may not deliver genuine chills, but it's an affectionate, solidly built tribute to Hollywood's classic creature features.";"42";"100,000";"Horror"
"71";"4";"71";"96";"90";"Tense, exciting, and often darkly comic, Argo recreates a historical event with vivid attention to detail and finely wrought characters.";"358";"100,000";"Drama"
"72";"6";"72";"97";"94";"Originally made in 1969, this recently reissued classic is a masterful examination of the inner workings of the World War II resistance efforts.";"75";"5,000";"Art House & International"
"73";"4";"73";"94";"82";"Arrival delivers a must-see experience for fans of thinking person's sci-fi that anchors its heady themes with genuinely affecting emotion and a terrific performance from Amy Adams.";"430";"50,000";"Drama"
"74";"4";"74";"92";"76";"Aardman Animations broadens their humor a bit for Arthur Christmas, a clever and earnest holiday film with surprising emotional strength.";"169";"10,000";"Animation"
"75";"4";"75";"99";"69";"Ash Is Purest White finds writer-director Zhangke Jia revisiting familiar themes while continuing to observe modern Chinese society with an urgent, empathetic eye.";"153";"100";"Romance"
"76";"6";"76";"98";"80";"Lean, taut and compellingly gritty, John Carpenter's loose update of Rio Bravo ranks as a cult action classic and one of the filmmaker's best.";"43";"10,000";"Action & Adventure"
"77";"4";"77";"100";"93";"Harrowing yet essential viewing, Athlete A shines an unforgiving light on horrific abuses -- as well as the culture that allowed them to continue unabated for years.";"56";"100";"Documentary"
"78";"4";"78";"96";"66";"An unpredictable supernatural drama rooted in real-world social commentary, Atlantique suggests a thrillingly bright future for debuting filmmaker Mati Diop.";"152";"100";"Romance"
"79";"4";"79";"94";"90";"Exciting, entertaining, and emotionally impactful, Avengers: Endgame does whatever it takes to deliver a satisfying finale to Marvel's epic Infinity Saga.";"538";"50,000";"Action & Adventure"
"80";"4";"80";"85";"91";"Avengers: Infinity War ably juggles a dizzying array of MCU heroes in the fight against their gravest threat yet, and the result is a thrilling, emotionally resonant blockbuster that (mostly) realizes its gargantuan ambitions.";"478";"50,000";"Action & Adventure"
"81";"2";"81";"97";"67";"The rare family-friendly feature with a heart as big as its special effects budget, Babe offers timeless entertainment for viewers of all ages.";"70";"250,000";"Kids & Family"
"82";"4";"82";"92";"86";"Stylish, exciting, and fueled by a killer soundtrack, Baby Driver hits the road and it's gone -- proving fast-paced action movies can be smartly written without sacrificing thrills.";"389";"50,000";"Action & Adventure"
"83";"1";"83";"96";"94";"Inventive, funny, and breathlessly constructed, Back to the Future is a rousing time-travel adventure with an unforgettable spirit.";"84";"250,000";"Action & Adventure"
"84";"6";"84";"97";"90";"Terrence Malick's debut is a masterful slice of American cinema, rife with the visual poetry and measured performances that would characterize his work.";"59";"25,000";"Action & Adventure"
"85";"6";"85";"100";"86";"Au Hasard Balthazar uses one animal's lifelong journey to trace a soberly compelling -- and ultimately heartbreaking -- outline of the human experience.";"43";"5,000";"Art House & International"
"86";"6";"86";"90";"73";"Elegantly animated and deeply touching, Bambi is an enduring, endearing, and moving Disney classic.";"52";"250,000";"Animation"
"87";"2";"87";"52";"74";"Bamboozled is too heavy-handed in its satire and comes across as more messy and overwrought than biting.";"105";"5,000";"Television"
"88";"4";"88";"85";"71";"Battle of the Sexes turns real-life events into a crowd-pleasing, well-acted dramedy that ably entertains while smartly serving up a volley of present-day parallels.";"313";"10,000";"Sports & Fitness"
"89";"2";"89";"94";"92";"Enchanting, sweepingly romantic, and featuring plenty of wonderful musical numbers, Beauty and the Beast is one of Disney's most elegant animated offerings.";"118";"250,000";"Animation"
"90";"3";"90";"55";"63";"An old-fashioned, if bland, adaptation of Kate DiCamillo's novel.";"122";"25,000";"Sports & Fitness"
"91";"3";"91";"41";"75";"Beerfest features some laugh-inducing gags, but is too long and the pacing too uneven to form a coherent, functioning comedy.";"108";"100,000";"Sports & Fitness"
"92";"4";"92";"98";"82";"Building on the first two installments in Richard Linklater's well-crafted Before trilogy, Before Midnight offers intelligent, powerfully acted perspectives on love, marriage, and long-term commitment.";"206";"25,000";"Romance"
"93";"2";"93";"100";"93";"Thought-provoking and beautifully filmed, Before Sunrise is an intelligent, unabashedly romantic look at modern love, led by marvelously natural performances from Ethan Hawke and Julie Delpy.";"46";"50,000";"Romance"
"94";"3";"94";"94";"91";"Filled with engaging dialogue, Before Sunset is a witty, poignant romance, with natural chemistry between Hawke and Delpy.";"177";"50,000";"Romance"
"95";"4";"95";"94";"71";"Affectionate without sacrificing honesty, Behind the Candelabra couples award-worthy performances from Michael Douglas and Matt Damon with some typically sharp direction from Steven Soderbergh.";"107";"10,000";"Television"
"96";"4";"96";"95";"87";"";"78";"10,000";"Television"
"97";"3";"97";"94";"84";"Good-natured and mirthful, Best Worst Movie is a sweet deconstruction of how a cinematic folly can become a triumph.";"69";"2,500";"Television"
"98";"4";"98";"98";"87";"Free of the hagiographic overtones that dog many documentary profiles, Beware of Mr. Baker presents a clear-eyed, thoroughly gripping look at one of rock's greatest -- and most personally problematic -- musicians.";"53";"2,500";"Musical & Performing Arts"
"99";"2";"99";"82";"83";"Even if you aren't a fan, Beyond the Mat provides a riveting, perceptive look into the world of professional wrestling by taking a closer look at the people beneath the personas.";"67";"5,000";"Sports & Fitness"
"100";"6";"100";"98";"94";"An Italian neorealism exemplar, Bicycle Thieves thrives on its non-flashy performances and searing emotion.";"65";"25,000";"Drama"
"101";"1";"101";"97";"82";"Refreshingly sweet and undeniably funny, Big is a showcase for Tom Hanks, who dives into his role and infuses it with charm and surprising poignancy.";"74";"250,000";"Comedy"
"102";"4";"102";"89";"91";"Agreeably entertaining and brilliantly animated, Big Hero 6 is briskly-paced, action-packed, and often touching.";"226";"100,000";"Animation"
"103";"2";"103";"96";"84";"The performances in Big Night are wonderful, and the food looks delicious.";"56";"5,000";"Romance"
"104";"3";"104";"96";"81";"Bigger, Stronger, Faster* is a fascinating, informative, entertaining and especially introspective account of the American 'enhancement' culture.";"76";"100,000";"Special Interest"
"105";"3";"105";"99";"92";"Suffused with happiness and modest charm, Bill Cunningham New York offers a touching, gently humorous portrait of its subject without invading his jealously guarded privacy.";"74";"2,500";"Documentary"
"106";"4";"106";"91";"77";"A thrilling leap forward for director Alejandro GonzГЎlez IГ±ГЎrritu, Birdman is an ambitious technical showcase powered by a layered story and outstanding performances from Michael Keaton and Edward Norton.";"354";"50,000";"Comedy"
"107";"4";"107";"95";"90";"BeyoncГ© is King.";"61";"2,500";"Musical & Performing Arts"
"108";"6";"108";"90";"86";"Colorful, atmospheric, and infections, Black Orpheus takes an ancient tale and makes it fresh anew, thanks in part to its bewitching bossa nova soundtrack.";"41";"5,000";"Musical & Performing Arts"
"109";"4";"109";"96";"79";"Black Panther elevates superhero cinema to thrilling new heights while telling one of the MCU's most absorbing stories -- and introducing some of its most fully realized characters.";"519";"50,000";"Action & Adventure"
"110";"4";"110";"98";"90";"Blackfish is an aggressive, impassioned documentary that will change the way you look at performance killer whales.";"131";"25,000";"Documentary"
"111";"4";"111";"96";"83";"BlacKkKlansman uses history to offer bitingly trenchant commentary on current events -- and brings out some of Spike Lee's hardest-hitting work in decades along the way.";"443";"10,000";"Comedy"
"112";"4";"112";"75";"61";"Blackthorn invites comparisons to a classic Western -- and survives, thanks largely to a charismatic performance by a well-chosen Sam Shepard.";"75";"1,000";"Western"
"113";"1";"113";"90";"91";"Misunderstood when it first hit theaters, the influence of Ridley Scott's mysterious, neo-noir Blade Runner has deepened with time. A visually remarkable, achingly human sci-fi masterpiece.";"121";"250,000";"Science Fiction & Fantasy"
"114";"4";"114";"88";"81";"Visually stunning and narratively satisfying, Blade Runner 2049 deepens and expands its predecessor's story while standing as an impressive filmmaking achievement in its own right.";"439";"50,000";"Action & Adventure"
"115";"3";"115";"82";"73";"Blank City pays affectionate tribute to the No Wave filmmakers' movement -- and the bygone New York City that birthed it.";"44";"500";"Television"
"116";"6";"116";"88";"91";"Daring, provocative, and laugh-out-loud funny, Blazing Saddles is a gleefully vulgar spoof of Westerns that marks a high point in Mel Brooks' storied career.";"59";"100,000";"Western"
"117";"3";"117";"98";"83";"A powerful glimpse of the possibilities for transcendence in straightforward documentary filmmaking -- and extreme physical disability.";"50";"1,000";"Special Interest"
"118";"1";"118";"94";"88";"Brutally violent and shockingly funny in equal measure, Blood Simple offers early evidence of the Coen Brothers' twisted sensibilities and filmmaking ingenuity.";"104";"25,000";"Mystery & Suspense"
"119";"4";"119";"98";"74";"Clever, funny, and original, Blow the Man Down is a cinematic journey that's not to be missed.";"120";"250";"Comedy"
"120";"2";"120";"98";"93";"Three Colors: Blue contains some of director/co-writer Krzysztof Kieslowski's most visually arresting, emotionally resonant work -- and boasts an outstanding performance from Juliette Binoche in the bargain.";"46";"25,000";"Art House & International"
"121";"3";"121";"89";"74";"Bolt is a pleasant animated comedy that overcomes the story's familiarity with strong visuals and likable characters.";"189";"250,000";"Animation"
"122";"4";"122";"91";"73";"Bone Tomahawk's peculiar genre blend won't be for everyone, but its gripping performances and a slow-burning story should satisfy those in search of something different.";"95";"10,000";"Horror"
"123";"4";"123";"96";"77";"Fast-paced, funny, and fresh, Booksmart does the seemingly impossible by adding a smart new spin to the coming-of-age comedy.";"372";"2,500";"Comedy"
"124";"4";"124";"97";"76";"Thrilling, unpredictable, and brilliantly acted, Border (GrГ¤ns) offers a singular treat to genre fans looking for something different.";"128";"1,000";"Art House & International"
"125";"3";"125";"95";"91";"A powerful and uplifting documentary.";"108";"10,000";"Musical & Performing Arts"
"126";"3";"126";"95";"83";"Though it may not always convince, Bowling for Columbine asks important questions and provokes thought.";"173";"100,000";"Documentary"
"127";"3";"127";"95";"75";"";"42";"1,000";"Sports & Fitness"
